"Germany","Modernisation fund for shipping, including traffic innovation and support for renewing government vessels.","oil and gas","03/06/2020","03/06/2020",1141552512
"India","Increased borrowing limited for states pegged to power sector reforms (Atma Nirbhar Bharat Abhiyan)","non-applicable (non-energy measure)","17/05/2020","17/05/2020",7219485865
"India","Coal India Limited Investment Decision in Coal Transportation Infrastructure","coal","16/05/2020","18/05/2020",6747183052
"India","Liquidity boost for power distribution companies (Atma Nirbhar Bharat Abhiyan, Tranche 1)","multiple energy types","13/05/2020","13/05/2020",12144929492
"India","Free LPG cylinders under Pradhan Mantri Garib Kalyan Yojana to 80000000 beneficiaries of Pradhan Mantri Ujjwala Yojana","oil and oil products","26/03/2020","01/04/2020",1754267594
"Indonesia","Economic Recovery Program: Bailout for PT Kereta Api Indonesia (Railway SOE)","multiple energy types","11/05/2020","11/05/2020",240018604
"Indonesia","Economic Recovery Program: Compensation Payment for PT Pertamina (Oil &#038; Gas SOE)","oil and gas","11/05/2020","11/05/2020",2594258221
"Indonesia","Economic Recovery Program: Bailout for Garuda Indonesia (Airline SOE)","oil and oil products","11/05/2020","11/05/2020",582902323
"Indonesia","Economic Recovery Program:Compensation Payment to PLN","multiple fossil","11/05/2020","11/05/2020",3120241846
"Indonesia","3 months electricity bill exemption for residential 450 VA customers and 50% discount for residential 900 VA customers","multiple energy types","05/04/2020","05/04/2020",240018604
"Russia","Airline subsidies due to coronavirus traffic decreases","oil and oil products","13/05/2020","13/05/2020",324526732
"Russia","Partial compensation of operation costs by airports","oil and oil products","29/05/2020","29/05/2020",151168435
"Australia","Waiving electricity bills for small to medium businesses","multiple energy types","01/04/2020","01/04/2020",18582244
"Australia","Renewable energy training facility","multiple renewable","16/06/2020","16/06/2020",11699932
"Germany","Bailout of Condor","oil and oil products","27/04/2020","27/04/2020",627853882
"Germany","Bailout of TUI AG (including TUI Fly and cruiseships)","oil and oil products","08/04/2020","08/04/2020",5479452055
"Australia","$100 million electricity bill relief for small and medium businesses","multiple energy types","27/03/2020","01/05/2020",68823125
"Australia","Deferral of rent collection and annual fees for quarries and exploration companies","multiple fossil","22/05/2020","01/07/2020",2408810
"Germany","Support for public transport within municipal budgets (economic stimulus package)","multiple energy types","03/06/2020","03/06/2020",2853881279
"Germany","Modernization of buildings for energy efficiency (economic stimulus package)","energy efficiency","03/06/2020","03/06/2020",2283105023
"Australia","CEFC investment in Electric Vehicle charging infrastructure","multiple energy types","16/06/2020","16/06/2020",2408810
"Australia","Advancing Hydrogen Fund","hydrogen","04/05/2020","04/05/2020",206469374
"Germany","Hydrogen foreign trade partnerships","hydrogen","03/06/2020","03/06/2020",2283105023
"Australia","ARENA funding to fast track renewables for hydrogen","hydrogen","15/04/2020","15/04/2020",48176188
"Germany","National Hydrogen Strategy (part of the economic stimulus package)","hydrogen","03/06/2020","03/06/2020",10273972603
"Canada","Cost relief for electricity for residential, farm and small business consumers","multiple energy types","24/03/2020","25/03/2020",12677107
"Canada","Funding for airlines in Northwest Territories","oil and oil products","08/05/2020","08/05/2020",10903058
"Canada","Regulatory relief for Saskatchewan oil and gas producers","oil and gas","14/04/2020","14/04/2020",19388517
"Canada","Waiving of rent for ground leases for 21 airport authorities","oil and oil products","30/03/2020","30/03/2020",247129009
"Canada","Funding the Alberta Energy Regulator for 6 months by covering industry levies","oil and gas","20/03/2020","20/03/2020",84265474
"Canada","Temporary 90% reduction of the operating budget of Canadian Energy Centre","oil and gas","30/03/2020","30/03/2020",-4996271
"United Kingdom","£3bn scheme to improve buildings&#8217; efficiency as part of the  Plan for Jobs","energy efficiency","07/07/2020","01/09/2020",3846153847
"United Kingdom","Emergency £1.6bn bailout for Transport for London","multiple energy types","14/05/2020","14/05/2020",2051282052
"China","Extension of subsidies for electric vehicles","multiple energy types","23/04/2020","23/04/2020",1637443849
"United Kingdom","Scottish Government £62 million Energy Transition Fund","multiple fossil","12/06/2020","12/06/2020",79487180
"United Kingdom","Ofgem&#8217;s scheme of 350 million pounds available to support energy suppliers that do not have an investment grade credit rating","multiple energy types","02/06/2020","02/06/2020",448717949
"United Kingdom","Launch of the Clean Growth Fund","multiple renewable","21/05/2020","21/05/2020",25641026
"Saudi Arabia","Additional electricity subsidies as a relief measure for commercial, industrial and agricultural sectors","oil and gas","15/04/2020","15/04/2020",2.4e+08
"United Kingdom","Support to Iberdrola International B.V. through Covid Corporate Financing Facility (CCFF)","wind","23/03/2020","23/03/2020",128205129
"United Kingdom","Support to National Express Group PLC through Covid Corporate Financing Facility (CCFF)","multiple energy types","23/03/2020","23/03/2020",384615385
"United Kingdom","Support for Honda Finance Europe PLC through Covid Corporate Financing Facility (CCFF)","oil and oil products","23/03/2020","23/03/2020",141025642
"United Kingdom","Support for Nissan Motor Co., Ltd through Covid Corporate Financing Facility (CCFF)","multiple energy types","23/03/2020","23/03/2020",769230770
"United Kingdom","Support for RCL Cruises Ltd. through Covid Corporate Financing Facility (CCFF)","oil and oil products","23/03/2020","23/03/2020",384615381
"United Kingdom","Support for Baker Hughes through Covid Corporate Financing Facility (CCFF)","oil and oil products","23/03/2020","23/03/2020",769230770
"United Kingdom","Support for Schlumberger through Covid Corporate Financing Facility (CCFF)","oil and oil products","23/03/2020","23/03/2020",532051283
"United Kingdom","Support for EasyJet through Covid Corporate Financing Facility (CCFF)","oil and oil products","23/03/2020","23/03/2020",769230770
"United Kingdom","Support for Ryanair through Covid Corporate Financing Facility (CCFF)","oil and oil products","23/03/2020","23/03/2020",769230770
"France","Government backed loans to Air France airline company with  climate strings attached","oil and oil products","24/04/2020","07/05/2020",7990867580
"United Kingdom","Support for British Airways through Covid Corporate Financing Facility (CCFF)","oil and oil products","23/03/2020","23/03/2020",384615385
"United Kingdom","Support for Wizz Air through Covid Corporate Financing Facility (CCFF)","oil and oil products","23/03/2020","23/03/2020",384615385
